{
  "schemaVersion": 2,
  "meta": {
    "date": "2026-01-14",
    "dayLabel": "Wednesday 14 January 2026",
    "generatedAt": "07:30",
    "owner": "Alex Rivera (sample)",
    "governingAnswer": "Northwind is the only decision that moves revenue this week — settle the 12-month question before the 11:00 call; everything else is calendar triage.",
    "evidenceNote": "SAMPLE DATA — fictional company. Calendar: 6 of 6 Outlook events included. Inbox & Teams 48 h. Nothing sent; two drafts created.",
    "updateMechanism": "Rewritten each weekday at 07:30 by the scheduled run into OneDrive/ExecCommandCenter."
  },
  "kpis": [
    {
      "id": "decisions",
      "label": "Decisions waiting on you",
      "value": 2,
      "unit": "",
      "status": "amber",
      "threshold": "RED ≥ 3 · AMBER 1–2 · GREEN 0",
      "fires": "Clear before the first customer call",
      "decision": "What to unblock first",
      "trend": "Down from 4 yesterday",
      "evidence": "verified"
    },
    {
      "id": "dealdays",
      "label": "Revenue at risk",
      "value": 12,
      "unit": "deal-days",
      "status": "red",
      "threshold": "RED < 14 · AMBER 14–29 · GREEN ≥ 30",
      "fires": "Written answer to the customer this week",
      "decision": "Seek a 12-month ruling or hold",
      "trend": "Northwind offer expires 26 Jan",
      "evidence": "estimate"
    },
    {
      "id": "load",
      "label": "Calendar load — accepted",
      "value": 5.5,
      "unit": "h",
      "status": "green",
      "threshold": "RED ≥ 7h with conflict · AMBER ≥ 7h · GREEN < 7h",
      "fires": "Hygiene proposals",
      "decision": "Where to protect time",
      "trend": "Thu has no free block",
      "evidence": "verified"
    },
    {
      "id": "overdue",
      "label": "Commitments overdue",
      "value": 1,
      "unit": "",
      "status": "amber",
      "threshold": "RED ≥ 4 · AMBER 1–3 · GREEN 0",
      "fires": "Ledger review",
      "decision": "Close vs renegotiate",
      "trend": "Oldest 3 days",
      "evidence": "verified"
    }
  ],
  "decisions": [
    {
      "id": "d1",
      "status": "red",
      "evidence": "verified",
      "title": "Northwind — seek a 12-month ruling before the 11:00 call, or hold the 3-year line?",
      "situation": "Offer sent 12 Jan: 18% for 2,500 seats over 3 years, valid to 26 Jan.",
      "complication": "CIO asked twice for a 12-month option; a competitor pilot is running in one division.",
      "whyNow": "The 11:00 call is the first live reaction and the question will be asked.",
      "ifNothingChanges": "Silence reads as 'no'; offer lapses 26 Jan; deal slips a quarter.",
      "verb": "Change play",
      "recommendation": "Get a ruling from the deal desk this morning; answer the CIO in one note with the comparison.",
      "ask": "Send the draft to the deal desk; take the question into the call.",
      "links": [
        {
          "label": "Approval thread",
          "url": "https://example.contoso.com/mail/1"
        },
        {
          "label": "Draft to deal desk",
          "url": "https://example.contoso.com/mail/draft1"
        }
      ]
    },
    {
      "id": "d2",
      "status": "amber",
      "evidence": "inferred",
      "title": "Thursday — which slot of the Fabrikam briefing day is yours?",
      "situation": "Fabrikam briefing 09:30–16:30 Thursday; you have two accepted internal meetings in the morning.",
      "complication": "The organiser asked for issues 'asap'.",
      "whyNow": "Today's prep call is the last natural moment to give a window.",
      "ifNothingChanges": "You are assigned a morning slot you cannot attend.",
      "verb": "Reallocate",
      "recommendation": "Claim the afternoon slot.",
      "ask": "Tell the organiser on the 13:30 prep call.",
      "links": []
    }
  ],
  "calendar": {
    "dayStart": 8,
    "dayEnd": 18,
    "events": [
      {
        "id": "e1",
        "title": "Leadership stand-up",
        "start": "08:30",
        "end": "09:00",
        "kind": "accepted",
        "note": "Weekly; you organise.",
        "brief": {
          "readTime": "1 min",
          "stake": {
            "text": "Routine weekly stand-up you organise; the only live item is Thursday's Fabrikam coverage.",
            "evidence": "verified"
          },
          "decisions": [],
          "preReads": [],
          "questions": [
            {
              "rank": 1,
              "text": "If we confirm the 3-year structure, can you sign this quarter?",
              "impact": "Unlocks the deal and settles the seat count"
            },
            {
              "rank": 2,
              "text": "What would a 12-month term need to include for you to accept it?",
              "impact": "Tells you whether to seek a ruling"
            },
            {
              "rank": 3,
              "text": "Which adoption workstreams matter most to your teams?",
              "impact": "Steers the partner budget before the SOW"
            },
            {
              "rank": 4,
              "text": "Where is the alternative vendor in your evaluation today?",
              "impact": "Decides whether the compete track is needed"
            },
            {
              "rank": 5,
              "text": "Who signs and what is your approval path?",
              "impact": "Sets the real close date"
            }
          ],
          "outOfTime": {
            "criticalDecision": "Get a yes/no on the 3-year structure.",
            "fallback": "Send the written comparison today and book 15 minutes before the expiry date."
          },
          "sources": [
            {
              "type": "calendar",
              "label": "Recurring series",
              "url": ""
            }
          ],
          "generatedAt": "2026-01-14 07:30"
        }
      },
      {
        "id": "e2",
        "title": "Northwind — renewal call",
        "start": "11:00",
        "end": "11:30",
        "kind": "customer",
        "note": "Customer · CIO attending. Walk in knowing the 12-month question.",
        "brief": {
          "readTime": "1 min",
          "stake": {
            "text": "Northwind's renewal offer (18% for a 2,500-seat, 3-year term) expires in 12 days and the CIO has asked twice whether a 12-month option exists. This is the first live conversation since the offer went out.",
            "evidence": "verified"
          },
          "decisions": [
            {
              "text": "Confirm whether a 12-month structure at 2,500 seats is approvable before answering the CIO",
              "owner": "me",
              "deadline": "today"
            }
          ],
          "preReads": [
            {
              "title": "RE: Northwind renewal — approval thread",
              "url": "https://example.contoso.com/mail/1",
              "why": "The exact approved terms",
              "minutes": 3
            },
            {
              "title": "Northwind v-team chat — adoption scope",
              "url": "https://example.contoso.com/teams/1",
              "why": "What the partner plan covers",
              "minutes": 2
            }
          ],
          "questions": [
            {
              "rank": 1,
              "text": "If we confirm the 3-year structure, can you sign this quarter?",
              "impact": "Unlocks the deal and settles the seat count"
            },
            {
              "rank": 2,
              "text": "What would a 12-month term need to include for you to accept it?",
              "impact": "Tells you whether to seek a ruling"
            },
            {
              "rank": 3,
              "text": "Which adoption workstreams matter most to your teams?",
              "impact": "Steers the partner budget before the SOW"
            },
            {
              "rank": 4,
              "text": "Where is the alternative vendor in your evaluation today?",
              "impact": "Decides whether the compete track is needed"
            },
            {
              "rank": 5,
              "text": "Who signs and what is your approval path?",
              "impact": "Sets the real close date"
            }
          ],
          "outOfTime": {
            "criticalDecision": "Get a yes/no on the 3-year structure.",
            "fallback": "Send the written comparison today and book 15 minutes before the expiry date."
          },
          "sources": [
            {
              "type": "email",
              "label": "Northwind renewal thread",
              "url": "https://example.contoso.com/mail/1"
            },
            {
              "type": "chat",
              "label": "Northwind v-team",
              "url": "https://example.contoso.com/teams/1"
            },
            {
              "type": "transcript",
              "label": "Last occurrence (7 Jan)",
              "url": "https://example.contoso.com/transcript/1"
            }
          ],
          "generatedAt": "2026-01-14 07:30"
        }
      },
      {
        "id": "e3",
        "title": "Lunch",
        "start": "13:00",
        "end": "14:00",
        "kind": "block",
        "note": "Your block.",
        "brief": {
          "readTime": "30 sec",
          "stake": {
            "text": "Your lunch block; the 13:30 prep overlaps its second half.",
            "evidence": "verified"
          },
          "decisions": [],
          "preReads": [],
          "questions": [
            {
              "rank": 1,
              "text": "Move lunch on days with a 13:30 call?",
              "impact": "Only reason this might matter today"
            },
            {
              "rank": 2,
              "text": "—",
              "impact": "No further question warranted"
            },
            {
              "rank": 3,
              "text": "—",
              "impact": "No further question warranted"
            },
            {
              "rank": 4,
              "text": "—",